<?xml version='1.0' encoding='UTF-8'?>
<!--

    Copyright (C) 2007-2008 Elastic Grid, LLC.
    
    This file is part of Elastic Grid.
    
    Elastic Grid is free software: you can redistribute it and/or modify
    it under the terms of the GNU Lesser General Public License as
    published by the Free Software Foundation, either version 3 of the
    License, or any later version.
    
    Elastic Grid is distributed in the hope that it will be useful,
    but WITHOUT ANY WARRANTY; without even the implied warranty of
    MERCHANTABILITY or FITNESS FOR A PARTICULAR PURPOSE.  See the
    GNU General Public License for more details.
    
    You should have received a copy of the GNU Lesser General Public License
    along with Elastic Grid.  If not, see <http://www.gnu.org/licenses/>.

-->

<clusters xmlns:xsi="http://www.w3.org/2001/XMLSchema-instance"
          xsi:noNamespaceSchemaLocation="elastic-grid.xsd">
    <cluster name="cluster1">
        <node profile="monitor">ec2-75...</node>
        <node profile="monitor">ec2-77...</node>
        <node profile="agent">ec2-37...</node>
    </cluster>
    <cluster name="cluster2">
        <node profile="monitor">ec2-57...</node>
        <node profile="monitor">ec2-63...</node>
        <node profile="agent">ec2-31...</node>
    </cluster>
</clusters>